{
  "requestVersion": "1",
  "projectId": "22222222-2222-4222-8222-222222222222",
  "image": {
    "imageId": 1,
    "bucket": "roomify-example",
    "storageKey": "rooms/example/original/room.png",
    "contentType": "image/png",
    "width": 1024,
    "height": 768
  },
  "objects": [
    {
      "objectId": "11111111-1111-4111-8111-111111111111",
      "label": "bed",
      "confidence": 0.9,
      "bbox": {
        "x": 0.1,
        "y": 0.1,
        "w": 0.5,
        "h": 0.5
      },
      "decision": "KEEP"
    }
  ],
  "preferences": {
    "style": "SCANDINAVIAN",
    "preferredColors": [
      "sage",
      "cream"
    ],
    "roomPurpose": "STUDY_AND_SLEEP",
    "rentalFriendly": true,
    "specialRequirements": "Add storage without moving the bed."
  },
  "budget": {
    "amount": 9000,
    "currency": "TWD"
  }
}
